{
  "schema_version": "ppg-stage-contract/v0.1",
  "stage_id": "S16",
  "stage_name": "Export repository hygiene and handoff",
  "purpose": "Package final paper and prove delivery cleanliness.",
  "execution_mode": "hybrid_generated",
  "recommended_agent_type": "verifier",
  "requires_worker_task_packet": false,
  "consumes": [
    "clean final candidate",
    "review closure",
    "repair-complete package",
    "figures/captions",
    "repository state"
  ],
  "produces": [
    "export manifest",
    "repository hygiene report",
    "manager handoff report"
  ],
  "validators": [
    "build success",
    "rendered surface checks",
    "manifest hashes",
    "dirty worktree classification"
  ],
  "backflow_targets": [
    "S12",
    "S13",
    "S15",
    "owner"
  ],
  "completion_gate": "content-ready and delivery-clean states are separately proven; external submission remains owner-gated",
  "activation_policy": "activate when export/handoff requested",
  "coverage_status": "planned_full_stage",
  "registry_ref": "runtime/stage_registry.json",
  "worker_authority_boundary": {
    "completion_forbidden": true,
    "no_recursive_orchestration": true,
    "controller_owned_completion": true
  },
  "worker_packet_coverage": {
    "status": "not_required",
    "packet_ref": null,
    "return_contract_ref": null,
    "blocker": "Stage is owner-gated, script-generated, or main-controller assembly; fake worker packets are forbidden."
  }
}
