{
  "schema_version": "ppg-stage-contract/v0.1",
  "stage_id": "S03",
  "stage_name": "Novelty and contribution option analysis",
  "purpose": "Identify viable contribution framings without treating speculation as evidence.",
  "execution_mode": "agent_generated",
  "recommended_agent_type": "critic",
  "requires_worker_task_packet": true,
  "consumes": [
    "research dossier",
    "evidence inventory",
    "motivation",
    "SOTA map"
  ],
  "produces": [
    "contribution options",
    "novelty readiness",
    "risk list"
  ],
  "validators": [
    "evidence readiness score",
    "source anchors",
    "owner semantic-shift gate"
  ],
  "backflow_targets": [
    "S00",
    "S02",
    "S04"
  ],
  "completion_gate": "viable options are classified as supported, owner-gated, or rejected",
  "activation_policy": "activate when contribution is unstable or weak",
  "coverage_status": "planned_with_worker_packet",
  "registry_ref": "runtime/stage_registry.json",
  "worker_authority_boundary": {
    "completion_forbidden": true,
    "no_recursive_orchestration": true,
    "controller_owned_completion": true
  },
  "worker_packet_coverage": {
    "status": "linked_strict_packet",
    "packet_ref": "examples/packets/phase10_s03_novelty_analysis_packet.v1.yaml",
    "return_contract_ref": "schemas/ppg-candidate-return.schema.json",
    "blocker": null
  }
}
