{
  "schema_version": "ppg-stage-contract/v0.1",
  "stage_id": "S01",
  "stage_name": "Source citation evidence inventory",
  "purpose": "Make raw paper inputs locatable and support-safe.",
  "execution_mode": "hybrid_generated",
  "recommended_agent_type": "explore",
  "requires_worker_task_packet": false,
  "consumes": [
    "initial files",
    "result dirs",
    "BibTeX",
    "source locators"
  ],
  "produces": [
    "source map",
    "citation bank",
    "evidence bank"
  ],
  "validators": [
    "source locator resolution",
    "privacy boundary check",
    "evidence path check"
  ],
  "backflow_targets": [
    "S00",
    "S04"
  ],
  "completion_gate": "claim-relevant sources are locator-backed or explicitly unresolved",
  "activation_policy": "activate when source or evidence inventory is missing/stale",
  "coverage_status": "planned_full_stage",
  "registry_ref": "runtime/stage_registry.json",
  "worker_authority_boundary": {
    "completion_forbidden": true,
    "no_recursive_orchestration": true,
    "controller_owned_completion": true
  },
  "worker_packet_coverage": {
    "status": "not_required",
    "packet_ref": null,
    "return_contract_ref": null,
    "blocker": "Stage is owner-gated, script-generated, or main-controller assembly; fake worker packets are forbidden."
  }
}
